name,slug,categories,status,shortDescription,websiteUrl,logoUrl,twitterUrl,discordUrl,docsUrl,longDescription,coreFeatures,isFeatured,featuredOrder
项目名称,项目链接名可留空自动生成,项目分类可多选用英文分号分隔,项目状态必填,一句话简介必填,官网链接必填,Logo图片链接可选,Twitter或X链接可选,Discord链接可选,文档链接可选,项目长简介可选,核心功能多个用英文分号分隔,是否精选true或false,精选排序数字可留空
"CatBal","catbal","NFT;DeFi","Live","CatBal 是 Hyperliquid 生态中的猫主题社区 memecoin，围绕 Cat Cabal 叙事、IP 和 NFT 文化扩展。","https://www.catbal.io/","https://coin-images.coingecko.com/coins/images/51085/large/Catbal_Minilogo.png?1732046278","https://x.com/CatCabal_hl","","","CatBal 是通过 Hypurr Fun Bot 创建的 Hyperliquid 生态 memecoin，主题围绕猫、cabal 和社区共创文化。项目内容偏向 meme、IP 和社区叙事，计划向图片、动画、漫画、移动应用、游戏和 NFT 等方向扩展。放在 HyperEVM Hub 中，CatBal 更适合作为 NFT / 文化类与 DeFi 社区资产的交叉项目展示。","Hyperliquid 社区 memecoin;猫主题 IP 叙事;社区 meme 内容;NFT 与文化扩展方向","false",""
"OpenSea","opensea","NFT;Infra","Live","OpenSea 是主流 NFT 交易市场，为 HyperEVM / Hyperliquid 生态 NFT 提供外部交易和展示入口。","https://opensea.io/","","https://x.com/opensea","","https://docs.opensea.io/","OpenSea 是加密行业最知名的 NFT 交易市场之一，支持用户浏览、购买、出售和管理 NFT。对于 HyperEVM / Hyperliquid 生态而言，OpenSea 可作为 NFT 收藏品和生态资产的外部展示与交易入口，帮助项目获得更广泛的 NFT 用户触达。","NFT 市场;NFT 浏览与交易;收藏品展示;外部流动性入口","false",""
"Drip Trade","drip-trade","NFT;Infra","Live","Drip Trade 是面向 Hyperliquid / HyperEVM 生态的 NFT 交易市场和收藏品发现入口。","https://drip.trade/","","","","","Drip Trade 是围绕 Hyperliquid / HyperEVM 生态构建的 NFT 交易与发现平台，重点服务生态内收藏品、社区资产和 NFT 项目。它可以帮助用户查看、交易和发现 HyperEVM 相关 NFT，也为生态项目提供更垂直的市场入口。","HyperEVM NFT 市场;收藏品发现;生态 NFT 交易;社区资产展示","false",""
"TinyHyperCats","tiny-hyper-cats","NFT","Live","TinyHyperCats 是 Hyperliquid 上的早期 NFT 收藏品，包含 2222 个 fully onchain tiny cats。","https://opensea.io/collection/tiny-hyper-cats-hyperevm","","","","","TinyHyperCats 是 Hyperliquid / HyperEVM 生态中的早期 NFT 收藏品，项目介绍为 2222 个 fully onchain tiny cats，并强调其作为 Hyperliquid 首批 NFT 收藏品之一的历史位置。它更适合作为生态 NFT 文化和早期收藏品代表收录。","2222 个 Tiny Cats;Fully onchain NFT;Hyperliquid 早期 NFT 收藏品;生态文化资产","false",""
"PiP","pip","NFT;DeFi","Live","PiP 是 Hyperliquid 生态的 liquid mascot，以社区 meme、吉祥物文化和 PIP token 叙事为核心。","https://x.com/PipOnHL","https://coin-images.coingecko.com/coins/images/51298/large/JPEG_image-458B-A87B-DA-0.jpeg?1734770153","https://x.com/PipOnHL","","","PiP 是 Hyperliquid 生态中的 liquid mascot，围绕活泼、社区友好和 meme 文化展开。PiP 以 PIP token 和社区叙事为载体，强调 Hyperliquid 生态中的轻松、玩梗和文化传播属性。它既可以被视为社区文化项目，也可以作为生态 token / meme 资产收录。","Hyperliquid mascot;社区 meme 文化;PIP token 叙事;生态文化传播","false",""
"Hypurr","hypurr","NFT","Live","Hypurr 是 Hyperliquid 生态代表性 NFT 收藏品之一，也是社区文化中最具辨识度的猫形象之一。","https://opensea.io/collection/hypurr-hyperevm","https://coin-images.coingecko.com/nft_contracts/images/26031/small/Screenshot_2025-10-03_at_5.50.01%E2%80%AFPM.jpg?1759485070","","","","Hypurr 是 Hyperliquid / HyperEVM 生态中的代表性 NFT 收藏品和社区文化符号。它以猫形象和 Hyperliquid 社区叙事为核心，在生态地图和社区传播中具有很高辨识度。作为 NFT 项目收录时，Hypurr 可以帮助用户理解 Hyperliquid 生态的文化资产和早期收藏品方向。","Hyperliquid NFT 收藏品;猫主题社区文化;生态文化符号;早期收藏品代表","false",""
"Hypio","hypio","NFT","Live","Hypio 是 Hyperliquid 生态中的 NFT / 文化类项目，围绕 Hypio 角色和社区收藏品展开。","https://opensea.io/collection/wealthy-hypio-babies-hyperevm","https://coin-images.coingecko.com/nft_contracts/images/26032/small/Screenshot_2025-10-03_at_5.54.29%E2%80%AFPM.jpg?1759485313","","","","Hypio 是 Hyperliquid / HyperEVM 生态中的 NFT 和社区文化项目，图中高亮形象对应 Wealthy Hypio Babies 等收藏品线索。它更适合作为 NFT 文化资产收录，用于展示 HyperEVM 生态中围绕角色、收藏和社区身份构建的项目。","Hypio 角色 IP;NFT 收藏品;社区文化资产;Hyperliquid 生态 NFT","false",""